{
  "$schema": "../../../schemas/optativas-abiertas.schema.json",
  "schemaVersion": "1.0.0",
  "territorio": "es-as",
  "etapa": "bachillerato",
  "fuenteId": "es-as-bachillerato-decreto-60-2022",
  "criterioRepresentacion": "El Decreto 60/2022 publica orientaciones para estas optativas, pero no un repertorio cerrado de competencias específicas, criterios de evaluación y saberes básicos. Se documentan como fichas informativas, separadas de los JSON curriculares; su concreción corresponde a las programaciones docentes. Los identificadores son convenciones del proyecto, no códigos oficiales.",
  "optativas": [
    {
      "id": "es-as.bachillerato.optativa-abierta.gestion-de-fuentes-documentales-y-comunicacion",
      "nombre": "Gestión de Fuentes Documentales y Comunicación",
      "cursos": [2],
      "estado": "concrecion-docente"
    },
    {
      "id": "es-as.bachillerato.optativa-abierta.proyecto-de-investigacion-integrado",
      "nombre": "Proyecto de Investigación Integrado",
      "cursos": [1, 2],
      "estado": "concrecion-docente"
    },
    {
      "id": "es-as.bachillerato.optativa-abierta.recursos-energeticos-y-sostenibilidad",
      "nombre": "Recursos Energéticos y Sostenibilidad",
      "cursos": [1],
      "estado": "concrecion-docente"
    }
  ]
}
